{
    "$schema": "http://json-schema.org/draft-07/schema#",
    "type": "array",
    "items": {
        "type": "object",
        "required": [
            "id",
            "label",
            "description",
            "usecases",
            "table",
            "queryBody"
        ],
        "properties": {
            "id": {
                "type": "string"
            },
            "label": {
                "type": "string"
            },
            "description": {
                "type": "string"
            },
            "usecases": {
                "type": "array",
                "items": {
                    "type": "string"
                }
            },
            "table": {
                "type": "string"
            },
            "queryBody": {
                "type": "string"
            }
        },
        "additionalProperties": false
    }
}